providerName,providerNationalID,avgCoveredCharges,averagePayments
BAYLOR HEART AND VASCULAR HOSPITAL,450851,50902,17914
BAYLOR UNIVERSITY MEDICAL CENTER,450021,74220,25364
DOCTORS HOSPITAL,450678,164316,21375
MEDICAL CITY DALLAS HOSPITAL,450647,94302,20176
METHODIST CHARLTON MEDICAL CENTER,450723,56871,18663
METHODIST DALLAS MEDICAL CENTER,450051,72990,24719
PARKLAND HEALTH AND HOSPITAL SYSTEM,450015,83000,40786
TEXAS HEALTH PRESBYTERIAN HOSPITAL  DALLAS,450462,94905,21610
UT SOUTHWESTERN UNIVERSITY HOSPITAL,450044,89400,26117