providerName,providerNationalID,avgCoveredCharges,averagePayments
BAYLOR UNIVERSITY MEDICAL CENTER,450021,21607,6194
DOCTORS HOSPITAL,450678,30219,4815
MEDICAL CITY DALLAS HOSPITAL,450647,35727,5372
METHODIST CHARLTON MEDICAL CENTER,450723,19377,5265
METHODIST DALLAS MEDICAL CENTER,450051,21395,8125
PARKLAND HEALTH AND HOSPITAL SYSTEM,450015,21899,8878
SOUTH HAMPTON COMMUNITY HOSPITAL,670002,24484,5992
TEXAS HEALTH PRESBYTERIAN HOSPITAL  DALLAS,450462,27872,5514
UT SOUTHWESTERN UNIVERSITY HOSPITAL,450044,18707,5957