providerName,providerNationalID,avgCoveredCharges,averagePayments
CENTENNIAL HILLS HOSPITAL MEDICAL CENTER,290054,38310,5788
DESERT SPRINGS HOSPITAL,290022,36890,4838
MOUNTAINVIEW HOSPITAL,290039,36283,5421
SOUTHERN HILLS HOSPITAL AND MEDICAL CENTER,290047,37078,5510
SPRING VALLEY HOSPITAL MEDICAL CENTER,290046,31043,5037
SUMMERLIN HOSPITAL MEDICAL CENTER,290041,30851,5126
SUNRISE HOSPITAL AND MEDICAL CENTER,290003,30942,5961
UMC OF SOUTHERN NEVADA,290007,38656,9280
VALLEY HOSPITAL MEDICAL CENTER,290021,33907,5985