providerName,providerNationalID,avgCoveredCharges,averagePayments
CENTENNIAL HILLS HOSPITAL MEDICAL CENTER,290054,85089,11057
DESERT SPRINGS HOSPITAL,290022,83935,12362
MOUNTAINVIEW HOSPITAL,290039,116368,13489
SAINT ROSE DOMINICAN HOSPITAL - SAN MARTIN CAMPUS,290053,118761,14457
SPRING VALLEY HOSPITAL MEDICAL CENTER,290046,144900,15490
SUMMERLIN HOSPITAL MEDICAL CENTER,290041,111356,12842
SUNRISE HOSPITAL AND MEDICAL CENTER,290003,76269,13295
UMC OF SOUTHERN NEVADA,290007,65430,16130
VALLEY HOSPITAL MEDICAL CENTER,290021,115800,14550