providerName,providerNationalID,avgCoveredCharges,averagePayments
ADVOCATE ILLINOIS MASONIC MEDICAL CENTER,140182,67699,20268
JOHN H STROGER JR HOSPITAL,140124,18044,19826
MERCY HOSPITAL AND MEDICAL CENTER,140158,47520,20558
MT SINAI HOSPITAL MEDICAL CENTER,140018,52646,20332
NORTHWESTERN MEMORIAL HOSPITAL,140281,72380,15228
RESURRECTION MEDICAL CENTER,140117,86756,12512
RUSH UNIVERSITY MEDICAL CENTER,140119,89989,21050
THE UNIVERSITY OF CHICAGO MEDICAL CENTER,140088,100444,17598
UNIVERSITY OF ILLINOIS HOSPITAL,140150,69856,21714